CNPJ,Razão Social,Responsável Legal,Tel. Contato,Email,Status,
37.828.595/0001-88,Antonella e Olivia Locações de Automóveis ME,Antone,financeiro@antonellaeolivialocacoesdeautomoveisme.com.br,(84) 99767-9528,1,
01.588.588/0001-09,Daiane e João Lavanderia ME,Daiane,compras@daianeejoaolavanderiame.com.br,(11) 99640-4363,1,
24.936.025/0001-60,Noah e Ester Advocacia Ltda,Noah,auditoria@noaheesteradvocacialtda.com.br,84988276285,1,
64.831.189/0001-47,Otávio e Luiz Esportes ME,Otavio,contabil@otavioeluizesportesme.com.br,(27) 3781-8814,1,
30.977.745/0001-76,Rafael e Enrico Telecomunicações Ltda,Rafael,ouvidoria@rafaeleenricotelecomunicacoesltda.com.br,(27) 2970-9482,1,
55.947.826/0001-54,Ruan e Amanda Corretores Associados ME,Amanda,juridico@ruaneamandacorretoresassociadosme.com.br,(84) 98524-9022,1,
